id,level,sr_no,raw,kanji,hiragana,meaning,hint,sentence,supporting_word_1,supporting_word_2,page_no
1719,N2,174,各々,各々,おのおの,Each,,,,,64.0
1720,N2,175,負ぶう,負ぶう,おぶう,Put the diper on the baby,,母親は赤ちゃんを負ぶう～ています。,母親は赤ちゃんを,～ています。,18.0
1721,N2,176,覚え,覚え,おぼえ,"memory, sense, experience",マスターする、身につける,覚えがある (記憶) がいい (早い)、が悪い(遅い),,がある (記憶) がいい (早い)、が悪い(遅い)(マスターする、身につける),133.0
1722,N2,177,溺れる,溺れる,おぼれる,"to struggle in the water, to sink below the surface and become unable to breathe",,,,,20.0
1723,N2,178,お襁褓,お襁褓,おむつ,"diaper, nappy",,お母さんはお襁褓に赤ちゃんを入れました。,お母さんは,に赤ちゃんを入れました。,18.0
1724,N2,179,思い掛けず＊,思い掛けず,おもいがけず,"unexpectedly, surprisingly",予想していなかった,スピーチコンテストで思い掛けず,スピーチコンテストで,(予想していなかった),68.0
1725,N2,180,思いがけなく＊,思いがけなく,おもいがけなく,"unexpected, contrary to expectations",思わなかった,,,(思わなかった),68.0
1726,N2,181,思い切って＊,思い切って,おもいきって,"Boldly, decisively, daringly",勇気を出して〜する、大きいことを決める,好きな人に思い切って告白する。,好きな人に,告白する。(勇気を出して〜する、大きいことを決める),68.0
1727,N2,182,思い切り＊,思い切り,おもいきり,"as much as one wants, with all one's strength",100%の力で,父に思い切り叱られた。,父に,叱られた。(100%の力で),68.0
1728,N2,183,思い込む＊,思い込む,おもいこむ,"To be convinced (that), to be under the impression (that)",強く信じる,私はサンタクロースがいると思い込む〜でいる。,私はサンタクロースがいると,〜でいる。(強く信じる),126.0
1729,N2,184,思い付く＊,思い付く,おもいつく,"to think of, to hit upon",心、頭に思い浮ぶ,いいアイデアを思い付く。,いいアイデアを,。(心、頭に思い浮ぶ),126.0
1730,N2,185,思い遣りがある＊,思い遣りがある,おもいやりがある,"consideration, thoughtfulness",他の人の気持ち,,,(他の人の気持ち),44.0
1731,N2,186,主に,主に,おもに,"mainly, primarily",,大学で主に経済を勉強した。,大学で,経済を勉強した。,67.0
1732,N2,187,思わず,思わず,おもわず,"unconsciously, involuntarily, instinctively, reflexively, spontaneously",〜するつもりはなかったけど,痛くて思わず叫んだ。,痛くて,叫んだ。(〜するつもりはなかったけど),68.0
1733,N2,188,親指,親指,おやゆび,Thumb,,,,,54.0
1734,N2,189,凡そ,凡そ,およそ,"about, roughly, approximately​",,,,,63.0
1735,N2,190,下ろす,下ろす,おろす,"to take down, to bring down, to lower (a hand, flag, shutter, etc.)",,彼は荷物を車から下ろす～ました。,彼は荷物を車から,～ました。,22.0
1736,N2,191,負んぶ,負んぶ,おんぶ,"carrying (someone) on one's back (esp. a child), piggyback ride",,父親は子供を負んぶしています。,父親は子供を,しています。,18.0
1737,N2,192,～化,～化,～か,"change to ..., becoming …",,,,,117.0
1738,N2,193,～外,～外,～がい,"outside ..., beyond …",,,,,116.0
1739,N2,194,開会,開会,かいかい,opening of a meeting,,,,,83.0
1740,N2,195,買い換える＊,買い換える,かいかえる,o replace by buying something new,,古いテレビを新しいものと買い換える～ました。,古いテレビを新しいものと,～ました。,14.0
1741,N2,196,会議,会議,かいぎ,"A meeting, conference, session, council",,,,,32.0
1742,N2,197,改行,改行,かいぎょう,"new line, new paragraph",,,,,36.0
1743,N2,198,会計,会計,かいけい,"accounting, finance, account",,,,,83.0
1744,N2,199,会合,会合,かいごう,"meeting, assembly, gathering",,,,,83.0
1745,N2,200,開始,開始,かいし,"Start, beginning",,,,,35.0
1746,N2,201,会場,会場,かいじょう,"assembly hall, meeting place",,,,,83.0
1747,N2,202,外食,外食,がいしょく,Eating outside,,,,,22.0
1748,N2,203,海水浴,海水浴,かいすいよく,"Swimming in the ocean, sea bathing",,夏になると海水浴に行きたいです。,夏になると,に行きたいです。,20.0
1749,N2,204,～階建て＊,～階建て,～かいだて,n-storied building,,,,,12.0
1750,N2,205,快適(な),快適,かいてき,"Comfortable, pleasant, agreeable",気持ちが良い、便利、愛することに使いません,このホテルの部屋はとても快適です。,このホテルの部屋はとても,です。(気持ちが良い、便利、愛することに使いません),
1751,N2,206,回覧板,回覧板,かいらんばん,"circular notice (esp. in binder form, passed around households within a neighbourhood association, etc.)",,学校から回覧板が配布されました。,学校から,が配布されました。,13.0
1752,N2,207,却って,却って,かえって,"on the contrary, rather, instead",,,,,71.0
1753,N2,208,顔色,顔色,かおいろ,Complexion,,,,,54.0
1754,N2,209,顔が利く＊,顔が利く,かおがきく,to have a lot of influence (in),"あの店に信用があるから(chef, owner の知り合い) 、無理が言える",あの店には顔が利く,あの店には,"(あの店に信用があるから(chef, owner の知り合い) 、無理が言える)",129.0
1755,N2,210,顔が広い＊,顔が広い,かおがひろい,"well connected, well known",知り合いが多い,彼は政界(政治の世界)には顔が広い,彼は政界(政治の世界)には,(知り合いが多い),129.0
1756,N2,211,家屋,家屋,かおく,"house, building",,,,,86.0
1757,N2,212,顔を貸す＊,顔を貸す,かおをかす,to grant a person a moment,頼まれて人に会う、頼まれて人に話を聞きためにある人に会う,彼はチャリティーイベントに顔を貸す～ました。,彼はチャリティーイベントに,～ました。(頼まれて人に会う、頼まれて人に話を聞きためにある人に会う),129.0
1758,N2,213,顔を出す＊,顔を出す,かおをだす,"to turn up, to make an appearance",出席する(最初から最後までいない) ,あ(パーティー、飲み会、会議)に ② 妻が風邪を引いてしまったので、飲み会にちょっと顔を出して、帰ります。顔を出す,あ(パーティー、飲み会、会議)に ② 妻が風邪を引いてしまったので、飲み会にちょっと顔を出して、帰ります。,(出席する(最初から最後までいない) ),129.0
1759,N2,214,画家,画家,がか,"Painter, artist",,,,,86.0
1760,N2,215,抱える,抱える,かかえる,"To hold in one's arms, to have (problems, debts, etc.), to take on (a responsibility)",,,,,48.0
1761,N2,216,価格,価格,かかく,"A price, cost",,この製品の価格は高すぎます。,この製品の,は高すぎます。,17.0
1762,N2,217,踵+,踵,かかと,"heel (of foot, shoe, stocking, etc.)",,,,,54.0
1763,N2,218,掛かる,掛かる,かかる,"to take (a resource, e.g. time or money)",,,,,
1764,N2,219,書き込む＊,書き込む,かきこむ,"to fill in (field, entry, etc.), to fill out (form)",①空いているスペースに書く ②決まっている場所に書く,,,(①空いているスペースに書く ②決まっている場所に書く),
1765,N2,220,書き留める＊,書き留める,かきとめる,"to write down, to make a note of",書いて残して置く,講義の内容をメモに書き留める～ました。,講義の内容をメモに,～ました。(書いて残して置く),127.0
1766,N2,221,掻く,掻く,かく,"to scratch, to perspire",,犬は首を掻く～ているときに可愛く見えます。,犬は首を,～ているときに可愛く見えます。,
1767,N2,222,各～,各～,かく～,each ～,,,,,114.0
1768,N2,223,学者,学者,がくしゃ,"scholar, academic, scientist",,,,,80.0
1769,N2,224,学習,学習,がくしゅう,"Study, learning, tutorial",,,,,80.0
1770,N2,225,拡大,拡大,かくだい,"Expansion, extension",,,,,36.0
1771,N2,226,確定,確定,かくてい,"Decision, settlement, confirmation",,,,,36.0
1772,N2,227,学問,学問,がくもん,"Scholarship, study, learning",,,,,80.0
1773,N2,228,学力,学力,がくりょく,"scholarly ability, scholarship",,,,,80.0
1774,N2,229,掛ける,掛ける,かける,"to hang up (e.g. a coat, a picture on the wall)",,,,,110.0
1775,N2,230,家事,家事,かじ,"Household work, domestic chores",,,,,18.0
1776,N2,231,貸し借り＊,貸し借り,かしかり,lending and borrowing,,友達と貸し借りのルールを守りましょう。,友達と,のルールを守りましょう。,134.0
1777,N2,232,貸し出す＊,貸し出す,かしだす,"To lend, to loan",貸して、外に持って認める,図書館は本を貸し出す～ています。,図書館は本を,～ています。(貸して、外に持って認める),127.0
1778,N2,233,齧る,齧る,かじる,"to gnaw, to nibble, to bite",,,,,48.0
1779,N2,234,稼ぐ,稼ぐ,かせぐ,"to earn (income), to make (money)",,,,,29.0
1780,N2,235,下線,下線,かせん,"Underline, underscore",,,,,36.0
1781,N2,236,画僧,画僧,がぞう,artist-monk,,,,,37.0
1782,N2,237,肩+,肩,かた,Shoulder,,,,,54.0
1783,N2,238,～難い,～難い,～がたい,"difficult to ..., hard to ...​",,,,,118.0
1784,N2,239,片付ける＊,片付ける,かたづける,"to tidy up, to put in order, to straighten up",,,,,18.0
1785,N2,240,偏る,偏る,かたよる,"to lean (to one side), to incline",,彼の意見は偏る～ています。,彼の意見は,～ています。,22.0
1786,N2,241,課長,課長,かちょう,"Section manager, section chief",,,,,30.0
1787,N2,242,学会,学会,がっかい,"learned society, scientific society, academy",,,,,80.0
1788,N2,243,担ぐ,担ぐ,かつぐ,"To shoulder, to carry on one's shoulder",,,,,48.0
1789,N2,244,格好良い＊,格好良い,かっこいい,"attractive, good-looking, stylish",,,,,45.0
1790,N2,245,格好悪い＊,格好悪い,かっこわるい,"unattractive, ugly, unstylish",,,,,45.0
1791,N2,246,嘗て,嘗て,かつて,"once, before, formerly",昔、人の意見,嘗てそれは昭和時代以前の話です。,,それは昭和時代以前の話です。(昔、人の意見),100.0
1792,N2,247,勝手に,勝手に,かってに,"arbitrarily, of its own accord",,,,,101.0
1793,N2,248,家電製品,家電製品,かでんせいひん,"consumer electronics, home appliances",,家電製品を買う前に調査をしましょう。,,を買う前に調査をしましょう。,14.0
1794,N2,249,必ず,必ず,かならず,"Always, certainly",,,,,60.0
1795,N2,250,必ずしも,必ずしも,かならずしも,"(not) always, (not) necessarily",,,,,60.0
1796,N2,251,可也,可也,かなり,"considerably, fairly, quite",,この問題は可也難しい。,この問題は,難しい。,66.0
1797,N2,252,可燃ゴミ,可燃ゴミ,かねんゴミ,"combustible waste, burnable rubbish",,,,,14.0
1798,N2,253,花粉症,花粉症,かふんしょう,"Hay fever, pollinosis (allergy to pollen)",,,,,55.0
1799,N2,254,我慢,我慢,がまん,"endurance, patience, perseverance",,,,,55.0
1800,N2,255,紙お襁褓,紙お襁褓,かみおむつ,"paper diaper, disposable nappy",,新生児は紙お襁褓が必要です。,新生児は,が必要です。,18.0
1801,N2,256,噛む,噛む,かむ,"to bite, to chew",,,,,48.0
1802,N2,257,画面,画面,がめん,"A screen (of a TV, computer, etc.)",,,,,34.0
1803,N2,258,痒い,痒い,かゆい,itchy,,,,,55.0
1804,N2,259,揶揄う,揶揄う,からかう,"to tease, to make fun of",,,,,52.0
1805,N2,260,体が持たない＊,体が持たない,からだがもたない,"ruining one's health, exceeding the limits of one's body",,,,,30.0
1806,N2,261,空っぽ,空っぽ,からっぽ,"empty, vacant, hollow",何も入っていない,,,(何も入っていない),46.0
1807,N2,262,軽い,軽い,かるい,light (i.e. not heavy),,,,,112.0
1808,N2,263,枯れる,枯れる,かれる,"To wither (become dry and shriveled) (of a plant), to be blasted, to die",,,,,99.0
1809,N2,264,可愛がる＊,可愛がる,かわいがる,"to be affectionate to, to treat tenderly",,,,,18.0
1810,N2,265,～感,～感,～かん,"feeling, sensation, emotion",,,,,116.0
1811,N2,266,癌+,癌,がん,cancer,,,,,55.0
1812,N2,267,関係,関係,かんけい,"Relation, connection",,,,,28.0
1813,N2,268,元日,元日,がんじつ,First day of the year,,,,,76.0
1814,N2,269,感染,感染,かんせん,"infection, contagion",,,,,38.0
1815,N2,270,感謝,感謝,かんしゃ,"thanks, gratitude, appreciation",,,,,52.0
1816,N2,271,管理費,管理費,かんりひ,"administration costs, administrative expenses",,アパートの管理費は毎月支払う必要があります。,アパートの,は毎月支払う必要があります。,12.0
1817,N2,272,完了,完了,かんりょう,"Completion, conclusion",,,,,35.0
1818,N2,273,気が合わない＊,気が合わない,きがあわない,"not to get along (with someone), to be unlike-minded",強く否定する,A (噂/悪い評判) を気が合わない,A (噂/悪い評判) を,(強く否定する),130.0
1819,N2,274,気が重い＊,気が重い,きがおもい,"heavy-hearted, depressed",,お金ない、彼女ない気が重い,お金ない、彼女ない,,130.0
1820,N2,275,気が利く＊,気が利く,きがきく,"to be sensible, to be smart",①細かいことまで良く気付く ②お洒落な様子、よくできた,①彼女は ②〜たプレゼントがなかなか見つからない気が利く,①彼女は ②〜たプレゼントがなかなか見つからない,(①細かいことまで良く気付く ②お洒落な様子、よくできた),130.0
1821,N2,276,気がしない＊,気がしない,きがしない,Don't feel like,〜そう言う気持ちにならない,今勉強する (辞書形) 気がしない,今勉強する (辞書形) ,(〜そう言う気持ちにならない),130.0
1822,N2,277,気が進まない＊,気が進まない,きがすすまない,"reluctant to, not inclined to, disinclined",積極的にやりたいと思わない,今日は外出する気が進まない。,今日は外出する,。(積極的にやりたいと思わない),130.0
1823,N2,278,気が小さい＊,気が小さい,きがちいさい,"timid, faint-hearted",すぐ心配する,,,(すぐ心配する),44.0
1824,N2,279,気が強い＊,気が強い,きがつよい,"strong-willed, strong of heart",,,,,45.0
1825,N2,280,気が短い＊,気が短い,きがみじかい,"quick-tempered, having little patience",,,,,
1826,N2,281,気が弱い＊,気が弱い,きがよわい,"timid, faint of heart",,,,,45.0
1827,N2,282,気軽に＊,気軽に,きがるに,"freely, readily, cheerfully",,,,,28.0
1828,N2,283,聞き手＊,聞き手,ききて,"hearer, listener, audience",,,,,84.0
1829,N2,284,記号,記号,きごう,"A sign, symbol, mark",,,,,36.0
1830,N2,285,岸+,岸,きし,"Bank, coast, shore",,,,,21.0
1831,N2,286,生地,生地,きじ,"cloth, fabric, material",,,,,82.0
1832,N2,287,傷跡,傷跡,きずあと,scar,,,,,55.0
1833,N2,288,傷がつく＊,傷がつく,きずがつく,"to get damaged, to get chipped",,,,,99.0
1834,N2,289,傷口,傷口,きずぐち,"(opening of) a wound, (mouth of a) wound",,,,,55.0
1835,N2,290,傷付く＊,傷付く,きずつく,"to be wounded, to get injured",,,,,99.0
1836,N2,291,傷付ける＊,傷付ける,きずつける,"to wound, to injure",,,,,52.0
1837,N2,292,気体,気体,きたい,"gas, vapour",,,,,87.0
1838,N2,293,きつい＊＊,きつい,きつい,"tough, hard, severe",,,,,113.0
1839,N2,294,ぎっしり＊＊,ぎっしり,ぎっしり,"tightly (packed), densely",いっぱいに入っている,①子供達への土産が②本棚にぎっしり①入っていた。②本が入っている。,①子供達への土産が②本棚に,①入っていた。②本が入っている。(いっぱいに入っている),64.0
1840,N2,295,起動,起動,きどう,"Start-up, activation, starting (e.g. Engine, computer), launch",,,,,34.0
1841,N2,296,気に掛かる＊,気に掛かる,きにかかる,"to weigh on one's mind, to be worried about (something)​",≈気が掛かる (心配する、気になる) ,彼の健康状態が気に掛かる～ます。,彼の健康状態が,～ます。(≈気が掛かる (心配する、気になる) ),130.0
1842,N2,297,気に食わない＊,気に食わない,きにくわない,"to dislike, to be displeased with something",,彼の態度は気に食わない。,彼の態度は,。,130.0
1843,N2,298,機能,機能,きのう,"Function, facility, faculty",,このアプリの機能は便利です。 ,このアプリの,は便利です。 ,35.0
1844,N2,299,気分,気分,きぶん,Mood,,,,,87.0
1845,N2,300,基本,基本,きほん,"Basics, fundamentals",,数学の基本を理解することは重要です。,数学の,を理解することは重要です。,34.0
1846,N2,301,気味,気味,きみ,"sensation, feeling​",,,,,87.0
1847,N2,302,疑問,疑問,ぎもん,"Doubt, question, suspicion",なぜ、疑問に思う,,,(なぜ、疑問に思う),50.0
1848,N2,303,休暇,休暇,きゅうか,"holiday, day off",,,,,30.0
1849,N2,304,休憩,休憩,きゅうけい,"rest, break, recess",,,,,30.0
1850,N2,305,求人情報,求人情報,きゅうじんじょうほう,"job vacancy information, recruitment information",,,,,28.0
1851,N2,306,急用,急用,きゅうよう,Urgent work,,,,,80.0
1852,N2,307,器用(な),器用,きよう,"skillful, handy",,,,,45.0
1853,N2,308,強化,強化,きょうか,"strengthening, reinforcement",,,,,85.0
1854,N2,309,強力,強力,きょうりょく,"Powerful, strong",,,,,85.0
1855,N2,310,拒否,拒否,きょひ,"Refusal, rejection, denial, veto",,,,,38.0
1856,N2,311,気楽(な),気楽,きらく,"carefree, comfortable",,,,,87.0
1857,N2,312,切らす,切らす,きらす,"to run out of, to be short of",,,,,38.0
1858,N2,313,切り替える＊,切り替える,きりかえる,"to change, to exchange, to convert",,,,,38.0
1859,N2,314,切り取り＊,切り取り,きりとり,"tearing off, cutting (for a railroad, highway, etc.), robbery with assault",,,,,37.0
1860,N2,315,気力,気力,きりょく,"willpower, energy",,,,,84.0
1861,N2,316,切る,切る,きる,To cut (Dictionary form),,,,,108.0
1862,N2,317,切れる,切れる,きれる,"to break, to snap, to be cut",,,,,
1863,N2,318,切り取る＊,切り取る,きりとる,"to cut off, to excise, to tear off",,,,,37.0
1864,N2,319,気を落とす＊,気を落とす,きをおとす,"to be discouraged, to be disheartened",落ち込む,失敗して気を落とすことはありません。,失敗して,ことはありません。(落ち込む),130.0
1865,N2,320,気を使う＊,気を使う,きをつかう,"to worry (about), to be careful (about)",細かいところまで注意する,彼女は他人に気を使う優しい人です。,彼女は他人に,優しい人です。(細かいところまで注意する),130.0
1866,N2,321,気を悪く＊,気を悪く,きをわるくする,to take offense (at),嫌な気持ちになる,彼の発言に気を悪くしないでください。,彼の発言に,しないでください。(嫌な気持ちになる),130.0
1867,N2,322,～金,～金,～きん,Money,,,,,116.0
1868,N2,323,銀行口座,銀行口座,ぎんこうこうざ,Bank account,,,,,22.0
1869,N2,324,近所付き合い＊,近所付き合い,きんじょづきあい,interaction with one's neighbors,,,,,13.0
1870,N2,325,緊張,緊張,きんちょう,"Tension, strain, nervousness",どきどきする,,,(どきどきする),28.0
1871,N2,326,勤務,勤務,きんむ,"Service, duty, work",,,,,28.0
1872,N2,327,具合が悪い＊,具合が悪い,ぐあいがわるい,"unwell, in a bad state",,,,,
1873,N2,328,空中,空中,くうちゅう,"sky, air, mid-air",,,,,78.0
1874,N2,329,薬指,薬指,くすりゆび,Ring finger,,,,,54.0
1875,N2,330,具体的(な),具体的,ぐたいてき,"Concrete, definite, specific",,,,,32.0
1876,N2,331,口が上手い＊,口が上手い,くちがうまい,"honeymouthed, fair-spoken",ただ話が上手なだけ,彼は口が上手いから、人を説得しやすいです。,彼は,から、人を説得しやすいです。(ただ話が上手なだけ),128.0
1877,N2,332,口が堅い＊,口が堅い,くちがかたい,"tight-lipped, able to keep a secret",,彼は口が堅い～く、秘密を守ります。,彼は,～く、秘密を守ります。,128.0
1878,N2,333,口が悪い＊,口が悪い,くちがわるい,"sarcastic, having a sharp tongue",言葉が乱暴,彼の口が悪いので、注意が必要です。,彼の,ので、注意が必要です。(言葉が乱暴),128.0
1879,N2,334,口に合わない＊,口に合わない,くちにあわない,to suit one's taste,自分の嫌い味,その料理は私には口に合わない。,その料理は私には,。(自分の嫌い味),128.0
1880,N2,335,口にする＊,口にする,くちにする,"to taste, to eat, to drink",〜ていない (①食べていない②話す),①私は昨日から何も口にする①〜ていない ②のも嫌いな話だ。,①私は昨日から何も,①〜ていない ②のも嫌いな話だ。(〜ていない (①食べていない②話す)),128.0
1881,N2,336,口に出す＊,口に出す,くちにだす,"to put into words, to say out loud",言葉にして話す,思ったことを口に出すことは大切です。,思ったことを,ことは大切です。(言葉にして話す),128.0
1882,N2,337,食っ付ける＊,食っ付ける,くっつける,"to attach, to stick together, to paste",,,,,48.0
1883,N2,338,ぐっと＊＊,ぐっと,ぐっと,"suddenly, at once, in one go",前と全然違う、すごく変わる,,,(前と全然違う、すごく変わる),67.0
1884,N2,339,寛ぐ,寛ぐ,くつろぐ,"to relax, to feel at home​",,週末には家で寛ぐ～ます。,週末には家で,～ます。,17.0
1885,N2,340,諄い,諄い,くどい,"repetitious, heavy (taste), gaudy (colour, design, etc.)","繰り返す is verb, 諄い is adj",彼の話は諄い～く同じことを繰り返す,彼の話は,"～く同じことを繰り返す(繰り返す is verb, 諄い is adj)",44.0
1886,N2,341,配る,配る,くばる,"To distribute, to deliver",,,,,32.0
1887,N2,342,首になる＊,首になる,くびになる,"to be sacked, to be fired",,,,,33.0
1888,N2,343,組み合わせる＊,組み合わせる,くみあわせる,"To join together, combine",,これらの要素を組み合わせる～て新しいデザインを作りましょう。,これらの要素を,～て新しいデザインを作りましょう。,124.0
1889,N2,344,組み立てる＊,組み立てる,くみたてる,"To assemble, to set up",,家具を組み立てるのは難しいですか？,家具を,のは難しいですか？,124.0
1890,N2,345,組む,組む,くむ,"To assemble, to construct, to team up",,,,,32.0
1891,N2,346,悔しい,悔しい,くやしい,"frustrated (over a failure, humiliation or injustice), annoyed",,,,,
1892,N2,347,悔やむ,悔やむ,くやむ,to mourn,,,,,50.0
1893,N2,348,暗い,暗い,くらい,"Dark, gloomy",,,,,112.0
1894,N2,349,暮らす,暮らす,くらす,"To live, to get along","not only physical living but also the lifestyle, daily life, while 住む is only the physical act of residing in a particular place",彼は東京で暮らす～しています。 ,彼は東京で,"～しています。 (not only physical living but also the lifestyle, daily life, while 住む is only the physical act of residing in a particular place)",17.0
1895,N2,350,呉れ呉れも,呉れ呉れも,くれぐれも,"sincerely, wholeheartedly​",十分に〜てください。,,,(十分に〜てください。),67.0
1896,N2,351,黒字,黒字,くろじ,Profit (赤字),,,,,22.0
1897,N2,352,咥える,咥える,くわえる,to hold in one's mouth,,,,,48.0
1898,N2,353,詳しい,詳しい,くわしい,"detailed, full, minute",,,,,103.0
1899,N2,354,掲示板,掲示板,けいじばん,"display board, notice board",,,,,39.0
1900,N2,355,芸術家,芸術家,げいじゅつか,Artist,,,,,86.0
1901,N2,356,契約,契約,けいやく,"contract, agreement",,,,,34.0
1902,N2,357,血圧,血圧,けつあつ,Blood pressure,健康診断ではかる,定期的に血圧を測ることは健康のために大切です。,定期的に,を測ることは健康のために大切です。(健康診断ではかる),54.0
1903,N2,358,結果,結果,けっか,"Result, outcome, effect",,,,,52.0
1904,N2,359,結論,結論,けつろん,"Conclusion (of an argument, discussion, study, etc.)",,議論の結論として、新しい計画が承認されました。,議論の,として、新しい計画が承認されました。,32.0
1905,N2,360,貶す,貶す,けなす,to speak ill of,,,,,52.0
1906,N2,361,下品,下品,げひん,"Meanness, indecency",,,,,45.0
1907,N2,362,蹴る,蹴る,ける,To kick,,サッカーボールを蹴る～ました。,サッカーボールを,～ました。,19.0
1908,N2,363,現～,現～,げん～,"present (e.g. government, administration), current",,,,,115.0
1909,N2,364,見学,見学,けんがく,"Study tour, observation and learn",,,,,81.0
1910,N2,365,健康診断,健康診断,けんこうしんだん,Physical examination,,年に一度、健康診断を受けるべきです。,年に一度、,を受けるべきです。,54.0
1911,N2,366,検索,検索,けんさく,"looking up (e.g. a word in a dictionary), search (e.g. on the Internet)",,,,,34.0
1912,N2,367,故～,故～,こ～,"the late, the deceased",,,,,115.0
1913,N2,368,恋しい,恋しい,こいしい,"Yearned for, longed for, missed",,,,,50.0
1914,N2,369,高～①,高～,～たか,"quantity, amount, volume",,,,,114.0
1915,N2,370,高～②,高～,こう～,high,,,,,114.0
