id,level,sr_no,raw,kanji,hiragana,meaning,hint,sentence,supporting_word_1,supporting_word_2,page_no
843,N1,843,手に負えない＊,手に負えない,てにおえない,Unmanageable,,,,,144.0
844,N1,844,手はず,手はず,てはず,"Arrangements, preparations",,,,,66.0
845,N1,845,手引き＊,手引き,てびき,"Guidance, help",,,,,66.0
846,N1,846,デブ,デブ,デブ,"fat, chubby​",,,,,148.0
847,N1,847,手本,手本,てほん,"Model, example",自分のとってのいい例,①彼は学生達は②この手本①だ。②を見て書いてください。,①彼は学生達は②この,①だ。②を見て書いてください。(自分のとってのいい例),66.0
848,N1,848,出向く＊,出向く,でむく,"To go to a different location, be transferred",,,,,85.0
849,N1,849,手も足も出ない＊,手も足も出ない,てもあしもでない,"Unable to do anything, helpless",,,,,144.0
850,N1,850,手元,手元,てもと,"On hand, within reach",,,,,66.0
851,N1,851,デリケート(な),デリケート,デリケート,"Delicate, sensitive, fragile",,彼女は非常にデリケートな花のようにです。,彼女は非常に,な花のようにです。,
852,N1,852,手分け＊,手分け,てわけ,"Division of labor, sharing tasks",,,,,66.0
853,N1,853,手を打つ＊,手を打つ,てをうつ,"To take action, make a move",,,,,144.0
854,N1,854,手を切る＊,手を切る,てをきる,"To sever ties, relationships",,,,,144.0
855,N1,855,手を尽くす＊,手を尽くす,てをつくす,"To do one's best, make every effort",,,,,144.0
856,N1,856,手を抜く＊,手を抜く,てをぬく,"To cut corners, slack off",,,,,144.0
857,N1,857,手を焼く＊,手を焼く,てをやく,"To have trouble dealing with, be in a predicament",,,,,144.0
858,N1,858,伝記,伝記,でんき,Biography,,,,,87.0
859,N1,859,点差,点差,てんさ,Point difference,,,,,88.0
860,N1,860,テンション,テンション,テンション,"(emotional) tension, anxiety",,,,,123.0
861,N1,861,転じる,転じる,てんじる,"To change, shift",,,,,93.0
862,N1,862,伝説,伝説,でんせつ,"Tradition, legend",,,,,88.0
863,N1,863,てんで＊＊,てんで,てんで,"(not) at all, completely, utterly",,,,,57.0
864,N1,864,転々,転々,てんてん,"Moving from place to place, changing repeatedly",,,,,51.0
865,N1,865,点々,点々,てんてん,"Here and there, scattered",,,,,51.0
866,N1,866,同意,同意,どうい,"Agreement, consent, approval",,,,,66.0
867,N1,867,同一,同一,どういつ,"Identical, the same",,,,,66.0
868,N1,868,同期,同期,どうき,"Same period, corresponding period",,,,,66.0
869,N1,869,当日,当日,とうじつ,"Appointed day, the day (of issue, publication, etc.)",,,,,84.0
870,N1,870,同上,同上,どうじょう,The same as above,,,,,66.0
871,N1,871,当選,当選,とうせん,"being elected​, being selected (for a prize, etc.)",,彼は国会議員に当選しました。 ,彼は国会議員に,しました。 ,84.0
872,N1,872,同調,同調,どうちょう,"Agreement, harmony",,,,,66.0
873,N1,873,到底～ない＊,到底～ない,とうてい～ない,"By no means, impossible",どう頑張ってもダメだ。否定的な語彙,私は東大に合格するなんて到底～ない無理だ！,私は東大に合格するなんて,無理だ！(どう頑張ってもダメだ。否定的な語彙),55.0
874,N1,874,どうにか＊＊,どうにか,どうにか,"in some way or other, one way or another",(→取り急ぎお礼まで。),,,((→取り急ぎお礼まで。)),59.0
875,N1,875,当人,当人,とうにん,The person in question,,,,,84.0
876,N1,876,当番,当番,とうばん,"Duty, being on shift",,,,,84.0
877,N1,877,どうやら＊＊,どうやら,どうやら,"possibly, apparently, (seem) likely",,,,,59.0
878,N1,878,遠ざかる,遠ざかる,とおざかる,To move away or drift apart,遠く離れて行く、危ないから子供からストーブを遠ざける。、彼女を遠ざける。,意識が遠ざかる。,意識が,。(遠く離れて行く、危ないから子供からストーブを遠ざける。、彼女を遠ざける。),22.0
879,N1,879,遠回り＊,遠回り,とおまわり,Detour (Long cut),,,,,68.0
880,N1,880,兎角,兎角,とかく,①(doing) various things ②being apt to,,,,,58.0
881,N1,881,咎める,咎める,とがめる,To blame or reprimand,दम भरणे 、遅刻が多い、悪いところがある、優しく相談する,彼女は自分を咎めることなく、過去の過ちから学ぼうとしています。,彼女は自分を,ことなく、過去の過ちから学ぼうとしています。(दम भरणे 、遅刻が多い、悪いところがある、優しく相談する),18.0
882,N1,882,尖る,尖る,とがる,"To sharpen, become pointed",鋭い,尖る～たナイフ,,～たナイフ(鋭い),33.0
883,N1,883,時折,時折,ときおり,"Occasionally, at times",,,,,54.0
884,N1,884,途切れる＊,途切れる,とぎれる,"to break off, to come to an end, to be interrupted",途中で切る、もう１度始まることができます。,,,(途中で切る、もう１度始まることができます。),34.0
885,N1,885,説く,説く,とく,"To explain, advocate",,,,,88.0
886,N1,886,特産,特産,とくさん,"Specialty, local product",,,,,74.0
887,N1,887,独自,独自,どくじ,"Original, unique, distinctive, independent",,この製品は独自のデザインと機能を備えています。,この製品は,のデザインと機能を備えています。,94.0
888,N1,888,特集,特集,とくしゅう,"Feature, special coverage",,,,,74.0
889,N1,889,特色,特色,とくしょく,"Characteristic, feature",,,,,74.0
890,N1,890,特有,特有,とくゆう,"Unique, characteristic to a specific thing, place",,,,,74.0
891,N1,891,溶け込む＊,溶け込む,とけこむ,"to melt into, to dissolve into",,,,,128.0
892,N1,892,所々,所々,ところどころ,"here and there, in places​",あちこち,,,(あちこち),51.0
893,N1,893,土砂,土砂,どしゃ,"Earth and sand, sediment",,,,,76.0
894,N1,894,ドジる,ドジる,ドジる,"to fail, to mess up, to bungle",,,,,125.0
895,N1,895,土台,土台,どだい,"Foundation, base",,,,,76.0
896,N1,896,途絶える＊,途絶える,とだえる,"To stop, to cease, to come to an end",もう１度できません、天皇様からおいさんは即位される。,,,(もう１度できません、天皇様からおいさんは即位される。),
897,N1,897,咄嗟に,咄嗟に,とっさに,"at once, immediately, instantly",その瞬間,ボールが飛んで来たので、咄嗟に避けた。,ボールが飛んで来たので、,避けた。(その瞬間),54.0
898,N1,898,土手,土手,どて,"Embankment, levee",,,,,76.0
899,N1,899,整える,整える,ととのえる,"To put in order, to arrange",,,,,92.0
900,N1,900,止まる,止まる,とまる,"To stop, come to a halt",,,,,34.0
901,N1,901,留める,留める,とどめる,"To retain, keep",動かない、(頭、心に残している),君と出会いは記憶に留める。,君と出会いは記憶に,。(動かない、(頭、心に残している)),34.0
902,N1,902,惚ける,惚ける,とぼける,"to play dumb, to play innocent",態と知らないと言う事、知っているけど知らない振りする、娘返して、返事: そんな約束したかなあ。,,,(態と知らないと言う事、知っているけど知らない振りする、娘返して、返事: そんな約束したかなあ。),30.0
903,N1,903,乏しい,乏しい,とぼしい,"Meager, scarce",足りない,お金、経験に乏しい。,お金、経験に,。(足りない),38.0
904,N1,904,戸惑う＊,戸惑う,とまどう,"to be bewildered, to be perplexed",どうしたら良いのか分からず、困る,日本の生活に戸惑う。,日本の生活に,。(どうしたら良いのか分からず、困る),30.0
905,N1,905,富む,富む,とむ,"To be rich in, to be full of",財産がたくさんある、栄養がたくさんある,,,(財産がたくさんある、栄養がたくさんある),90.0
906,N1,906,共稼ぎ＊,共稼ぎ,ともかせぎ,(husband and wife) earning a living together​,,,,,148.0
907,N1,907,共働き＊,共働き,ともばたらき,"(husband and wife) both working, dual income",夫婦が共に働いている,,,(夫婦が共に働いている),148.0
908,N1,908,吃る,吃る,どもる,"to stammer, to stutter",緊張してどもっちゃった。,,,(緊張してどもっちゃった。),30.0
909,N1,909,トラウマ,トラウマ,トラウマ,trauma (usu. psychological),,,,,122.0
910,N1,910,取り敢えず＊,取り敢えず,とりあえず,"For now, temporarily",,,,,58.0
911,N1,911,取り急ぎ＊,取り急ぎ,とりいそぎ,"Hastily, for the time being",,,,,146.0
912,N1,912,取り囲む＊,取り囲む,とりかこむ,"To surround, encircle",,,,,126.0
913,N1,913,取り込む＊,取り込む,とりこむ,"to take in, to bring in, to introduce",,,,,128.0
914,N1,914,取り締まる＊,取り締まる,とりしまる,"To regulate, enforce",,,,,126.0
915,N1,915,取り調べる＊,取り調べる,とりしらべる,"To interrogate, investigate",,,,,126.0
916,N1,916,取り立てる＊,取り立てる,とりたてる,"To collect, demand",,,,,126.0
917,N1,917,取り次ぐ＊,取り次ぐ,とりつぐ,"to pass on (a message, thoughts, etc.), to convey",,,,,126.0
918,N1,918,取り引き＊,取り引き,とりひき,"Transaction, deal",,,,,126.0
919,N1,919,取り分＊,取り分,とりぶん,"Share, portion",,,,,84.0
920,N1,920,取り巻く＊,取り巻く,とりまく,"To surround, enclose",,,,,126.0
921,N1,921,取り混ぜる＊,取り混ぜる,とりまぜる,"To mix, blend",,,,,126.0
922,N1,922,取り戻す＊,取り戻す,とりもどす,"To regain, recover",,,,,126.0
923,N1,923,取り寄せる＊,取り寄せる,とりよせる,"To order, to send away for",,,,,126.0
924,N1,924,ドリル,ドリル,ドリル,"drill bit, drill",,,,,121.0
925,N1,925,取り分け＊,取り分け,とりわけ,"especially, particularly",特に,,,(特に),56.0
926,N1,926,蕩ける,蕩ける,とろける,"To melt, dissolve",熱で柔らかくなる、溶ける(水ー氷) ,チーズ、バターが蕩ける。,チーズ、バターが,。(熱で柔らかくなる、溶ける(水ー氷) ),32.0
927,N1,927,度忘れ＊,度忘れ,どわすれ,Forgetfulness,,,,,148.0
928,N1,928,内心,内心,ないしん,"Inner feelings, true thoughts",,,,,67.0
929,N1,929,ナイター,ナイター,ナイター,"game under lights (e.g. baseball), night game",,,,,133.0
930,N1,930,尚更,尚更,なおさら,"still more, even more, all the more",,,,,56.0
931,N1,931,長い目で見る＊,長い目で見る,ながいめでみる,"To take the long view, have a long-term perspective",,,,,142.0
932,N1,932,長々,長々,ながなが,"for a long time, at great length",,,,,51.0
933,N1,933,殴る,殴る,なぐる,"To strike, to hit, to punch",Punch,彼は怒っていて、壁に拳を殴る～ました。,彼は怒っていて、壁に拳を,～ました。(Punch),18.0
934,N1,934,嘆く,嘆く,なげく,"To lament, mourn",心を痛めて酷く悲しい気持ちになる,ペットの死、不合格を嘆く。,ペットの死、不合格を,。(心を痛めて酷く悲しい気持ちになる),30.0
935,N1,935,投げ出す＊,投げ出す,なげだす,"to throw down, to throw out",,,,,128.0
936,N1,936,和む,和む,なごむ,"To be softened, to calm down",落ち着く、トラックラスできる,①心が、この音楽を聞くと②寒さが和む①。②～で来た。,①心が、この音楽を聞くと②寒さが,①。②～で来た。(落ち着く、トラックラスできる),
937,N1,937,和やか(な),和やか,なごやか,"Gentle, harmonious",落ち着いている、平和な、穏やかな,①話し合いは和やか①に終わった。②な会話、彼、２人,①話し合いは,①に終わった。②な会話、彼、２人(落ち着いている、平和な、穏やかな),36.0
938,N1,938,情けない,情けない,なさけない,"Miserable, pitiable, shameful, deplorable",①恥ずかしい ②見っともない ③可哀想で見て居られない,注射で泣いて情けない。,注射で泣いて,。(①恥ずかしい ②見っともない ③可哀想で見て居られない),14.0
939,N1,939,情け深い＊,情け深い,なさけぶかい,"Compassionate, kind-hearted, sympathetic",,情け深い人が、捨てられた子猫を拾って育ててくれた。,,人が、捨てられた子猫を拾って育ててくれた。,12.0
940,N1,940,詰る,詰る,なじる,"to scold, to tell off, to find fault",相手の悪いところを言う,①先生は私にたくさんの質問を ②顔を詰る①～ました。②られた。,①先生は私にたくさんの質問を ②顔を,①～ました。②られた。(相手の悪いところを言う),18.0
941,N1,941,宥める,宥める,なだめる,To pacify or soothe,まあ、まあ、まあ、落ち着いて、Vaibhi の怒り,彼は友達の怒りを宥めるのが得意です。,彼は友達の怒りを,のが得意です。(まあ、まあ、まあ、落ち着いて、Vaibhi の怒り),18.0
942,N1,942,懐く,懐く,なつく,To become attached,慣れて、親しくなる,誰にでも懐く犬。,誰にでも,犬。(慣れて、親しくなる),18.0
943,N1,943,名付け親＊,名付け親,なづけおや,Godparent,,彼女は名付け親から受けた愛情に感謝しています。,彼女は,から受けた愛情に感謝しています。,19.0
944,N1,944,名付ける＊,名付ける,なづける,To name or christen,,AをB (名前) と名付ける。,AをB (名前) と,。,19.0
945,N1,945,何気ない＊,何気ない,なにげない,"Casual, nonchalant",なにも考えないで言ったこと,何気ない言葉に傷付く。,,言葉に傷付く。(なにも考えないで言ったこと),38.0
946,N1,946,何卒,何卒,なにとぞ,"please, kindly, I beg of you",何分(なにぶん),,,(何分(なにぶん)),146.0
947,N1,947,何もかも,何もかも,なにもかも,"Everything, all",,,,,138.0
948,N1,948,何より,何より,なにより,"Above all, more than anything",,,,,56.0
949,N1,949,生身,生身,なまみ,"Living flesh, human",,,,,84.0
950,N1,950,滑らか,滑らか,なめらか,"Smooth, polished",つるつる,滑らかな肌,,な肌(つるつる),36.0
951,N1,951,悩ます,悩ます,なやます,"To harass, to molest",,,,,90.0
952,N1,952,慣らす,慣らす,ならす,"To accustom, to train (e.g. One's ear)​",,,,,90.0
953,N1,953,成り立つ＊,成り立つ,なりたつ,"To be established, come into existence",,,,,130.0
954,N1,954,成る丈＊,成る丈,なるたけ,"as (much) as possible, as (much) as one can",,,,,58.0
955,N1,955,馴れ初め＊,馴れ初め,なれそめ,"start of a romance, beginning of love",,,,,148.0
956,N1,956,馴れ馴れしい,馴れ馴れしい,なれなれしい,"Overly familiar, too friendly",ソフさん,あの人は一度お茶を飲んだだけなのに、馴れ馴れしい態度をとる。,あの人は一度お茶を飲んだだけなのに、,態度をとる。(ソフさん),13.0
957,N1,957,何だ彼だ,何だ彼だ,なんだかんだ,"Somehow, in one way, another",,,,,138.0
958,N1,958,何て,何て,なんて,"how ...!, what ...!​",,,,,57.0
959,N1,959,何でもかんでも,何でもかんでも,なんでもかんでも,Anything and everything,,,,,138.0
960,N1,960,何と,何と,なんと,"what, how",,,,,57.0
961,N1,961,ナンパ,ナンパ,ナンパ,"playboy, picking up women",,,,,148.0
962,N1,962,似合い＊,似合い,にあい,"Suitability, compatibility",,,,,148.0
963,N1,963,ニート,ニート,ニート,"NEET (young person not in education, employment or training)",,,,,123.0
964,N1,964,似通う＊,似通う,にかよう,To resemble closely,,,,,91.0
965,N1,965,憎たらしい,憎たらしい,にくたらしい,"Hateful, detestable, abhorrent",憎いことは起きる,彼の行動は本当に憎たらしいです。,彼の行動は本当に,です。(憎いことは起きる),13.0
966,N1,966,逃げ出す＊,逃げ出す,にげだす,"To run away, to escape",,,,,128.0
967,N1,967,滲む,滲む,にじむ,"to spread, to blur",,,,,138.0
968,N1,968,日夜,日夜,にちや,"Day and night, constantly",,,,,72.0
969,N1,969,日中,日中,にっちゅう,"during the day, Japan and China​",,,,,72.0
970,N1,970,日当,日当,にちあて,"Daily allowance, per diem",,,,,79.0
971,N1,971,二度と～ない＊,二度と～ない,にどと～ない,Never again,これから絶対に〜ない,二度と～ない遅刻はしません。,,遅刻はしません。(これから絶対に〜ない),55.0
972,N1,972,鈍る,鈍る,にぶる,"To become dull, blunt",,,,,90.0
973,N1,973,入院,入院,にゅういん,To be hospitalized,する,部長の突然の入院で会社は混乱になってしまいました。,部長の突然の,で会社は混乱になってしまいました。(する),22.0
974,N1,974,入手,入手,にゅうしゅ,"Acquisition, obtaining",,,,,66.0
975,N1,975,妊娠,妊娠,にんしん,To become pregnant,する,彼女は妊娠中で、幸せそうです。,彼女は,中で、幸せそうです。(する),22.0
976,N1,976,認知症,認知症,にんちしょう,Dementia,Alzaimer is part of it,老齢に伴い、認知症のリスクが高まります。,老齢に伴い、,のリスクが高まります。(Alzaimer is part of it),23.0
977,N1,977,抜かす,抜かす,ぬかす,"To omit, to skip​, to overtake",,,,,90.0
978,N1,978,抜け出す＊,抜け出す,ぬけだす,"to break free, to get through (a difficult situation)",,,,,128.0
979,N1,979,音色,音色,ねいろ,Timber (Tone quality),,,,,76.0
980,N1,980,値打ち＊,値打ち,ねうち,"Price, value, dignity",,,,,94.0
981,N1,981,寝かす,寝かす,ねかす,To put to sleep,,母は子供たちを寝かす～えました。,母は子供たちを,～えました。,92.0
982,N1,982,寝かせる,寝かせる,ねかせる,"To let sit, lay to rest",,,,,92.0
983,N1,983,寝苦しい＊,寝苦しい,ねぐるしい,"Sleepless, unable to sleep",,暑くて寝苦しい。,暑くて,。,36.0
984,N1,984,猫の手も借りたい＊,猫の手も借りたい,ねこのてもかりたい,"Extremely busy, wanting even the help of a cat​",,,,,147.0
985,N1,985,捩れる,捩れる,ねじれる,"to get twisted, to get crooked",,,,,138.0
986,N1,986,ねた＊＊,ねた,ねた,"material (for a story, article, etc.), joke, proof",,,,,149.0
987,N1,987,妬む,妬む,ねたむ,"To envy, be jealous",だから嫌い、羨ましいでも嫌いの方で,彼女は他の成功者を妬む～でいる。,彼女は他の成功者を,～でいる。(だから嫌い、羨ましいでも嫌いの方で),18.0
988,N1,988,強請る＊,強請る,ねだる,"To beg, pester",Aが欲しいと言う、目下の人が目上の人に使う、同じレベル人,子供たちはお菓子、おもちゃを強請る～ました。,子供たちはお菓子、おもちゃを,～ました。(Aが欲しいと言う、目下の人が目上の人に使う、同じレベル人),18.0
989,N1,989,ネックになる＊,ネックになる,ネックになる,Becoming a problem,,,,,121.0
990,N1,990,熱中症,熱中症,ねっちゅうしょう,heatstroke,,熱中症にならないように水分をこまめに摂りましょう。,,にならないように水分をこまめに摂りましょう。,23.0
991,N1,991,粘り強い＊,粘り強い,ねばりづよい,"Tenacious, persevering, persistent",途中で切れない、柔らなくて伸ばす、最後まで頑張る,彼は粘り強い～く目標に向かって努力し続けました。,彼は,～く目標に向かって努力し続けました。(途中で切れない、柔らなくて伸ばす、最後まで頑張る),12.0
992,N1,992,根回し＊,根回し,ねまわし,"Laying the groundwork, behind-the-scenes maneuvering",,,,,84.0
993,N1,993,練る,練る,ねる,"To thicken into a paste (stirring over a flame)(knead), to polish (a plan, etc.)",,,,,90.0
994,N1,994,を上げる＊,を上げる,をあげる,"To raise, elevate",,,,,115.0
995,N1,995,念入り＊,念入り,ねんいり,"Careful, thorough",細かいところまでしっかり注意する、大雑把な,②彼女は家に来るので念入り①に化粧する②に掃除する。,②彼女は家に来るので,①に化粧する②に掃除する。(細かいところまでしっかり注意する、大雑把な),39.0
996,N1,996,捻挫,捻挫,ねんざ,Sprain,link with 捻る,足首を捻挫したので、安静にしてください。,足首を,したので、安静にしてください。(link with 捻る),
997,N1,997,ノイローゼ,ノイローゼ,ノイローゼ,"neurosis, nervous breakdown, mental problem",,,,,133.0
998,N1,998,逃す,逃す,のがす,"To miss (e.g. A chance), to lose, to let get away",(逃げさせた人、嫌な物から逃げる) 嫌な事を忘れよ！,チャンスを逃す～た。,チャンスを,～た。((逃げさせた人、嫌な物から逃げる) 嫌な事を忘れよ！),21.0
999,N1,999,逃れる,逃れる,のがれる,To escape or avoid,,彼女は事故から逃れることができました。,彼女は事故から,ことができました。,21.0
1000,N1,1000,軒並み＊,軒並み,のきなみ,"Across the board, universally",,,,,94.0
1001,N1,1001,残らず,残らず,のこらず,"Without exception, entirely",,,,,57.0
1002,N1,1002,望ましい,望ましい,のぞましい,"hoped for, preferable",Aであって欲しい,①バランスがいい食事するのが ②この仕事は経験があると③面接にはスーツが望ましい。,①バランスがいい食事するのが ②この仕事は経験があると③面接にはスーツが,。(Aであって欲しい),14.0
1003,N1,1003,乗っ取る＊,乗っ取る,のっとる,"To take over, hijack",,,,,130.0
1004,N1,1004,長閑(な),長閑,のどか,"tranquil, calm, quiet",静かでのんびりしている感じ、田舎,長閑な風景,,な風景(静かでのんびりしている感じ、田舎),36.0
1005,N1,1005,喉から手が出る＊,喉から手が出る,のどからてがでる,"To be in high demand, coveted",,,,,147.0
1006,N1,1006,罵る,罵る,ののしる,To scold or abuse verbally,あなたは悪いんだと、給料泥棒,彼は部下を罵る～ましたが、後で謝りました。,彼は部下を,～ましたが、後で謝りました。(あなたは悪いんだと、給料泥棒),18.0
1007,N1,1007,飲み込む＊,飲み込む,のみこむ,"To swallow, absorb",,,,,128.0
1008,N1,1008,飲み放題＊,飲み放題,のみほうだい,All-you-can-drink,,,,,148.0
1009,N1,1009,乗り込む＊,乗り込む,のりこむ,"to board, to embark on, to get into (a car)",,,,,128.0
1010,N1,1010,ノルマ,ノルマ,ノルマ,"(one's) quota, assignment​",,,,,122.0
1011,N1,1011,バージョンアップ,バージョンアップ,バージョンアップ,"(software) update, upgrade (to a new version)​",,,,,124.0
1012,N1,1012,肺炎,肺炎,はいえん,Pneumonia,,,,,23.0
1013,N1,1013,バイオ,バイオ,バイオ,"bio-, biotechnology",,,,,120.0
1014,N1,1014,ハイテク(な),ハイテク,ハイテク,high-tech,,,,,120.0
1015,N1,1015,ハイネック,ハイネック,ハイネック,high-necked,,,,,121.0
1016,N1,1016,売買,売買,ばいばい,"Trade, buying and selling",,,,,73.0
1017,N1,1017,映える,映える,はえる,"To shine, stand out",,,,,92.0
1018,N1,1018,捗る,捗る,はかどる,"To make progress, go smoothly",順調を進む,仕事、勉強が捗る。,仕事、勉強が,。(順調を進む),32.0
1019,N1,1019,儚い,儚い,はかない,"transient, short-lived, momentary",消えやすい、すぐに消えてしまう,②愛は儚い①夢だった。②ものだ。,②愛は,①夢だった。②ものだ。(消えやすい、すぐに消えてしまう),38.0
1020,N1,1020,馬鹿馬鹿しい,馬鹿馬鹿しい,ばかばかしい,"Absurd, ridiculous, nonsensical",,その冗談は馬鹿馬鹿しいです。,その冗談は,です。,14.0
1021,N1,1021,剥ぐ,剥ぐ,はぐ,"to tear off, to peel off",外にある(皮)ものを取る,,,(外にある(皮)ものを取る),32.0
1022,N1,1022,励ます,励ます,はげます,To encourage or cheer up,元気をつけてあげる、応援する,友人は私を励ます～てくれました。,友人は私を,～てくれました。(元気をつけてあげる、応援する),18.0
1023,N1,1023,剥げる,剥げる,はげる,"to peel off, to come off",,①壁のペンキが②古い本の表紙が剥げる①～てきた。②～ている。,①壁のペンキが②古い本の表紙が,①～てきた。②～ている。,32.0
1024,N1,1024,化ける,化ける,ばける,"To take the form of (esp. In ref. To a spirit, fox, raccoon dog, etc.)",,,,,34.0
1025,N1,1025,麻疹,麻疹,はしか,Measles,,麻疹の予防接種は非常に重要です。,,の予防接種は非常に重要です。,25.0
1026,N1,1026,弾く,弾く,はじく,"To pluck, play a musical instrument",防水加工、防水この、力で飛ばす,,,(防水加工、防水この、力で飛ばす),32.0
1027,N1,1027,恥じらう,恥じらう,はじらう,"To be shy, bashful",恥ずかしい気持ちになる,,,(恥ずかしい気持ちになる),91.0
1028,N1,1028,恥を掻く＊,恥を掻く,はじをかく,"To feel embarrassed or ashamed, to lose face",恥ずかしい気持ちになる,彼は恥を掻く～ないようによく注意します。,彼は,～ないようによく注意します。(恥ずかしい気持ちになる),15.0
1029,N1,1029,叩く②,叩く,はたく,"To strike, to hit, to beat (often with hands or an object)",誇りを取る,誇り、布団を叩く。,誇り、布団を,。(誇りを取る),16.0
1030,N1,1030,果たす,果たす,はたす,"To accomplish, to achieve, to carry out",,,,,90.0
1031,N1,1031,バツイチ,バツイチ,バツイチ,"x (mark), cross",,,,,148.0
